{
  "schema": "comparevi-history/review-bundle@v1",
  "generatedAtUtc": "__GENERATED_AT_UTC__",
  "targetRunsManifestPath": "__RESULTS_DIR__/pr-target-runs-manifest.json",
  "resultsDir": "__RESULTS_DIR__",
  "summary": {
    "targetCount": 1,
    "rawPreviewPairCount": 4,
    "reviewPairCount": 2,
    "primaryReviewerDestinationPolicy": "pair-level@v1"
  },
  "targets": [
    {
      "targetId": "dynamic-demo-target",
      "targetPath": "Tooling/demo/Demo.vi",
      "finalStatus": "succeeded",
      "finalReason": "completed",
      "rawPreviewPairCount": 4,
      "rawPreviewPairs": [
        {
          "targetId": "dynamic-demo-target",
          "targetPath": "Tooling/demo/Demo.vi",
          "mode": "front-panel",
          "comparison": {
            "index": 1,
            "baseRef": "front-panel-base-1",
            "headRef": "front-panel-head-1",
            "baseShortRef": "base-01",
            "headShortRef": "head-01",
            "baseSubject": null,
            "headSubject": null
          },
          "sectionKind": "overview",
          "sectionOrdinal": 0,
          "label": "Front Panel Overview",
          "debugReportHtmlRelativePath": "targets/001-demo/history/front-panel/Demo.vi-001-artifacts/compare-report.html",
          "baseImageRelativePath": "targets/001-demo/history/front-panel/Demo.vi-001-artifacts/compare-report_files/fp_1.png",
          "headImageRelativePath": "targets/001-demo/history/front-panel/Demo.vi-001-artifacts/compare-report_files/fp_2.png",
          "baseByteLength": 4,
          "headByteLength": 4,
          "baseImageSha256": "65ab12a8ff3263fbc257e5ddf0aa563c64573d0bab1f1115b9b107834cfa6971",
          "headImageSha256": "249b3c75a2a64d4a226527022be630d945e9144d520931f09eb59180a373501b",
          "sortKey": "Tooling/demo/Demo.vi|00|0001|00|0000|front-panel-overview"
        },
        {
          "targetId": "dynamic-demo-target",
          "targetPath": "Tooling/demo/Demo.vi",
          "mode": "front-panel",
          "comparison": {
            "index": 2,
            "baseRef": "front-panel-base-2",
            "headRef": "front-panel-head-2",
            "baseShortRef": "base-02",
            "headShortRef": "head-02",
            "baseSubject": null,
            "headSubject": null
          },
          "sectionKind": "overview",
          "sectionOrdinal": 0,
          "label": "Front Panel Overview",
          "debugReportHtmlRelativePath": "targets/001-demo/history/front-panel/Demo.vi-002-artifacts/compare-report.html",
          "baseImageRelativePath": "targets/001-demo/history/front-panel/Demo.vi-002-artifacts/compare-report_files/fp_1.png",
          "headImageRelativePath": "targets/001-demo/history/front-panel/Demo.vi-002-artifacts/compare-report_files/fp_2.png",
          "baseByteLength": 4,
          "headByteLength": 4,
          "baseImageSha256": "65ab12a8ff3263fbc257e5ddf0aa563c64573d0bab1f1115b9b107834cfa6971",
          "headImageSha256": "249b3c75a2a64d4a226527022be630d945e9144d520931f09eb59180a373501b",
          "sortKey": "Tooling/demo/Demo.vi|00|0002|00|0000|front-panel-overview"
        },
        {
          "targetId": "dynamic-demo-target",
          "targetPath": "Tooling/demo/Demo.vi",
          "mode": "block-diagram",
          "comparison": {
            "index": 1,
            "baseRef": "block-diagram-base-1",
            "headRef": "block-diagram-head-1",
            "baseShortRef": "base-01",
            "headShortRef": "head-01",
            "baseSubject": null,
            "headSubject": null
          },
          "sectionKind": "overview",
          "sectionOrdinal": 0,
          "label": "Block Diagram Overview",
          "debugReportHtmlRelativePath": "targets/001-demo/history/block-diagram/Demo.vi-001-artifacts/compare-report.html",
          "baseImageRelativePath": "targets/001-demo/history/block-diagram/Demo.vi-001-artifacts/compare-report_files/bd_1.png",
          "headImageRelativePath": "targets/001-demo/history/block-diagram/Demo.vi-001-artifacts/compare-report_files/bd_2.png",
          "baseByteLength": 4,
          "headByteLength": 4,
          "baseImageSha256": "6b7988e4cb5e0142731ff6486234734b1f0e91778b9e5e8e2f4827e5acb4bfc2",
          "headImageSha256": "273b36fb120cfa0e486c1e1e84b28216628e346775b839faaf707f94b129e413",
          "sortKey": "Tooling/demo/Demo.vi|01|0001|00|0000|block-diagram-overview"
        },
        {
          "targetId": "dynamic-demo-target",
          "targetPath": "Tooling/demo/Demo.vi",
          "mode": "block-diagram",
          "comparison": {
            "index": 2,
            "baseRef": "block-diagram-base-2",
            "headRef": "block-diagram-head-2",
            "baseShortRef": "base-02",
            "headShortRef": "head-02",
            "baseSubject": null,
            "headSubject": null
          },
          "sectionKind": "overview",
          "sectionOrdinal": 0,
          "label": "Block Diagram Overview",
          "debugReportHtmlRelativePath": "targets/001-demo/history/block-diagram/Demo.vi-002-artifacts/compare-report.html",
          "baseImageRelativePath": "targets/001-demo/history/block-diagram/Demo.vi-002-artifacts/compare-report_files/bd_1.png",
          "headImageRelativePath": "targets/001-demo/history/block-diagram/Demo.vi-002-artifacts/compare-report_files/bd_2.png",
          "baseByteLength": 4,
          "headByteLength": 4,
          "baseImageSha256": "6b7988e4cb5e0142731ff6486234734b1f0e91778b9e5e8e2f4827e5acb4bfc2",
          "headImageSha256": "273b36fb120cfa0e486c1e1e84b28216628e346775b839faaf707f94b129e413",
          "sortKey": "Tooling/demo/Demo.vi|01|0002|00|0000|block-diagram-overview"
        }
      ],
      "reviewPairCount": 2
    }
  ],
  "rawPreviewPairs": [
    {
      "targetId": "dynamic-demo-target",
      "targetPath": "Tooling/demo/Demo.vi",
      "mode": "front-panel",
      "comparison": {
        "index": 1,
        "baseRef": "front-panel-base-1",
        "headRef": "front-panel-head-1",
        "baseShortRef": "base-01",
        "headShortRef": "head-01",
        "baseSubject": null,
        "headSubject": null
      },
      "sectionKind": "overview",
      "sectionOrdinal": 0,
      "label": "Front Panel Overview",
      "debugReportHtmlRelativePath": "targets/001-demo/history/front-panel/Demo.vi-001-artifacts/compare-report.html",
      "baseImageRelativePath": "targets/001-demo/history/front-panel/Demo.vi-001-artifacts/compare-report_files/fp_1.png",
      "headImageRelativePath": "targets/001-demo/history/front-panel/Demo.vi-001-artifacts/compare-report_files/fp_2.png",
      "baseByteLength": 4,
      "headByteLength": 4,
      "baseImageSha256": "65ab12a8ff3263fbc257e5ddf0aa563c64573d0bab1f1115b9b107834cfa6971",
      "headImageSha256": "249b3c75a2a64d4a226527022be630d945e9144d520931f09eb59180a373501b",
      "sortKey": "Tooling/demo/Demo.vi|00|0001|00|0000|front-panel-overview"
    },
    {
      "targetId": "dynamic-demo-target",
      "targetPath": "Tooling/demo/Demo.vi",
      "mode": "front-panel",
      "comparison": {
        "index": 2,
        "baseRef": "front-panel-base-2",
        "headRef": "front-panel-head-2",
        "baseShortRef": "base-02",
        "headShortRef": "head-02",
        "baseSubject": null,
        "headSubject": null
      },
      "sectionKind": "overview",
      "sectionOrdinal": 0,
      "label": "Front Panel Overview",
      "debugReportHtmlRelativePath": "targets/001-demo/history/front-panel/Demo.vi-002-artifacts/compare-report.html",
      "baseImageRelativePath": "targets/001-demo/history/front-panel/Demo.vi-002-artifacts/compare-report_files/fp_1.png",
      "headImageRelativePath": "targets/001-demo/history/front-panel/Demo.vi-002-artifacts/compare-report_files/fp_2.png",
      "baseByteLength": 4,
      "headByteLength": 4,
      "baseImageSha256": "65ab12a8ff3263fbc257e5ddf0aa563c64573d0bab1f1115b9b107834cfa6971",
      "headImageSha256": "249b3c75a2a64d4a226527022be630d945e9144d520931f09eb59180a373501b",
      "sortKey": "Tooling/demo/Demo.vi|00|0002|00|0000|front-panel-overview"
    },
    {
      "targetId": "dynamic-demo-target",
      "targetPath": "Tooling/demo/Demo.vi",
      "mode": "block-diagram",
      "comparison": {
        "index": 1,
        "baseRef": "block-diagram-base-1",
        "headRef": "block-diagram-head-1",
        "baseShortRef": "base-01",
        "headShortRef": "head-01",
        "baseSubject": null,
        "headSubject": null
      },
      "sectionKind": "overview",
      "sectionOrdinal": 0,
      "label": "Block Diagram Overview",
      "debugReportHtmlRelativePath": "targets/001-demo/history/block-diagram/Demo.vi-001-artifacts/compare-report.html",
      "baseImageRelativePath": "targets/001-demo/history/block-diagram/Demo.vi-001-artifacts/compare-report_files/bd_1.png",
      "headImageRelativePath": "targets/001-demo/history/block-diagram/Demo.vi-001-artifacts/compare-report_files/bd_2.png",
      "baseByteLength": 4,
      "headByteLength": 4,
      "baseImageSha256": "6b7988e4cb5e0142731ff6486234734b1f0e91778b9e5e8e2f4827e5acb4bfc2",
      "headImageSha256": "273b36fb120cfa0e486c1e1e84b28216628e346775b839faaf707f94b129e413",
      "sortKey": "Tooling/demo/Demo.vi|01|0001|00|0000|block-diagram-overview"
    },
    {
      "targetId": "dynamic-demo-target",
      "targetPath": "Tooling/demo/Demo.vi",
      "mode": "block-diagram",
      "comparison": {
        "index": 2,
        "baseRef": "block-diagram-base-2",
        "headRef": "block-diagram-head-2",
        "baseShortRef": "base-02",
        "headShortRef": "head-02",
        "baseSubject": null,
        "headSubject": null
      },
      "sectionKind": "overview",
      "sectionOrdinal": 0,
      "label": "Block Diagram Overview",
      "debugReportHtmlRelativePath": "targets/001-demo/history/block-diagram/Demo.vi-002-artifacts/compare-report.html",